{
  "go_arch_lint": {
    "Type": "models.Check",
    "Payload": {
      "ExecutionWarnings": [],
      "ArchHasWarnings": false,
      "ArchWarningsDeps": [],
      "ArchWarningsNotMatched": [],
      "ArchWarningsDeepScan": [],
      "OmittedCount": 0,
      "ModuleName": "github.com/usadamasa/go-arch-metrics",
      "Qualities": [
        {
          "ID": "component_imports",
          "Used": true
        },
        {
          "ID": "vendor_imports",
          "Used": true
        },
        {
          "ID": "deepscan",
          "Used": true
        }
      ]
    }
  },
  "golangci_lint": {
    "Issues": [],
    "Report": {
      "Linters": [
        {
          "Name": "arangolint"
        },
        {
          "Name": "asasalint"
        },
        {
          "Name": "asciicheck"
        },
        {
          "Name": "bidichk"
        },
        {
          "Name": "bodyclose"
        },
        {
          "Name": "canonicalheader"
        },
        {
          "Name": "clickhouselint"
        },
        {
          "Name": "containedctx"
        },
        {
          "Name": "contextcheck"
        },
        {
          "Name": "copyloopvar"
        },
        {
          "Name": "cyclop",
          "Enabled": true
        },
        {
          "Name": "decorder"
        },
        {
          "Name": "depguard"
        },
        {
          "Name": "dogsled"
        },
        {
          "Name": "dupl"
        },
        {
          "Name": "dupword"
        },
        {
          "Name": "durationcheck"
        },
        {
          "Name": "embeddedstructfieldcheck"
        },
        {
          "Name": "errcheck",
          "Enabled": true
        },
        {
          "Name": "errchkjson"
        },
        {
          "Name": "errname"
        },
        {
          "Name": "errorlint"
        },
        {
          "Name": "exhaustive"
        },
        {
          "Name": "exhaustruct"
        },
        {
          "Name": "exhaustruct_v5"
        },
        {
          "Name": "exptostd"
        },
        {
          "Name": "forbidigo"
        },
        {
          "Name": "forcetypeassert"
        },
        {
          "Name": "funcorder"
        },
        {
          "Name": "fatcontext"
        },
        {
          "Name": "funlen",
          "Enabled": true
        },
        {
          "Name": "gci"
        },
        {
          "Name": "ginkgolinter"
        },
        {
          "Name": "gocheckcompilerdirectives"
        },
        {
          "Name": "gochecknoglobals"
        },
        {
          "Name": "gochecknoinits"
        },
        {
          "Name": "gochecksumtype"
        },
        {
          "Name": "gocognit",
          "Enabled": true
        },
        {
          "Name": "goconst"
        },
        {
          "Name": "gocritic"
        },
        {
          "Name": "gocyclo",
          "Enabled": true
        },
        {
          "Name": "godoclint"
        },
        {
          "Name": "godot"
        },
        {
          "Name": "godox"
        },
        {
          "Name": "err113"
        },
        {
          "Name": "gofmt"
        },
        {
          "Name": "gofumpt"
        },
        {
          "Name": "golines"
        },
        {
          "Name": "goheader"
        },
        {
          "Name": "goimports"
        },
        {
          "Name": "mnd"
        },
        {
          "Name": "modernize"
        },
        {
          "Name": "gomoddirectives"
        },
        {
          "Name": "gomodguard"
        },
        {
          "Name": "gomodguard_v2"
        },
        {
          "Name": "goprintffuncname"
        },
        {
          "Name": "gosec"
        },
        {
          "Name": "gosmopolitan"
        },
        {
          "Name": "govet",
          "Enabled": true
        },
        {
          "Name": "grouper"
        },
        {
          "Name": "iface"
        },
        {
          "Name": "importas"
        },
        {
          "Name": "inamedparam"
        },
        {
          "Name": "ineffassign",
          "Enabled": true
        },
        {
          "Name": "interfacebloat"
        },
        {
          "Name": "intrange"
        },
        {
          "Name": "iotamixing"
        },
        {
          "Name": "ireturn"
        },
        {
          "Name": "lll"
        },
        {
          "Name": "loggercheck"
        },
        {
          "Name": "maintidx",
          "Enabled": true
        },
        {
          "Name": "makezero"
        },
        {
          "Name": "mirror"
        },
        {
          "Name": "misspell"
        },
        {
          "Name": "musttag"
        },
        {
          "Name": "nakedret"
        },
        {
          "Name": "nestif",
          "Enabled": true
        },
        {
          "Name": "nilerr"
        },
        {
          "Name": "nilnesserr"
        },
        {
          "Name": "nilnil"
        },
        {
          "Name": "nlreturn"
        },
        {
          "Name": "noctx"
        },
        {
          "Name": "noinlineerr"
        },
        {
          "Name": "nonamedreturns"
        },
        {
          "Name": "nosprintfhostport"
        },
        {
          "Name": "paralleltest"
        },
        {
          "Name": "perfsprint"
        },
        {
          "Name": "prealloc"
        },
        {
          "Name": "predeclared"
        },
        {
          "Name": "promlinter"
        },
        {
          "Name": "protogetter"
        },
        {
          "Name": "reassign"
        },
        {
          "Name": "recvcheck"
        },
        {
          "Name": "revive"
        },
        {
          "Name": "rowserrcheck"
        },
        {
          "Name": "sloglint"
        },
        {
          "Name": "sqlclosecheck"
        },
        {
          "Name": "spancheck"
        },
        {
          "Name": "staticcheck",
          "Enabled": true
        },
        {
          "Name": "swaggo"
        },
        {
          "Name": "tagalign"
        },
        {
          "Name": "tagliatelle"
        },
        {
          "Name": "testableexamples"
        },
        {
          "Name": "testifylint"
        },
        {
          "Name": "testpackage"
        },
        {
          "Name": "thelper"
        },
        {
          "Name": "tparallel"
        },
        {
          "Name": "typecheck",
          "Enabled": true
        },
        {
          "Name": "unconvert"
        },
        {
          "Name": "unparam"
        },
        {
          "Name": "unqueryvet"
        },
        {
          "Name": "unused",
          "Enabled": true
        },
        {
          "Name": "usestdlibvars"
        },
        {
          "Name": "usetesting"
        },
        {
          "Name": "varnamelen"
        },
        {
          "Name": "wastedassign"
        },
        {
          "Name": "whitespace"
        },
        {
          "Name": "wrapcheck"
        },
        {
          "Name": "wsl"
        },
        {
          "Name": "wsl_v5"
        },
        {
          "Name": "zerologlint"
        },
        {
          "Name": "nolintlint"
        }
      ]
    }
  },
  "gosec": {
    "Golang errors": {},
    "Issues": [],
    "Stats": {
      "files": 17,
      "lines": 3916,
      "nosec": 13,
      "found": 0
    },
    "GosecVersion": "2.29.0"
  },
  "govulncheck": {
    "exit_code": 0,
    "status": "ok"
  },
  "modularity": {
    "packages": [
      {
        "exported_funcs": 0,
        "exported_methods": 2,
        "exported_types": 0,
        "files": 4,
        "import_path": "github.com/usadamasa/go-arch-metrics/cmd/analyze-arch-lint",
        "interface_types": 0,
        "loc": 729,
        "main_sequence": {
          "abstractness": 0,
          "afferent_coupling": 0,
          "distance": 0,
          "efferent_coupling": 0,
          "instability": 1,
          "recent_commit_count": 5,
          "structurally_constrained": false,
          "volatility": "volatile",
          "zone": "excluded"
        },
        "path": "cmd/analyze-arch-lint",
        "public_ratio": 0.058823529411764705,
        "unexported_funcs": 17,
        "unexported_methods": 2,
        "unexported_types": 13
      },
      {
        "exported_funcs": 8,
        "exported_methods": 4,
        "exported_types": 11,
        "files": 6,
        "import_path": "github.com/usadamasa/go-arch-metrics/cmd/analyze-modularity",
        "interface_types": 0,
        "loc": 1848,
        "main_sequence": {
          "abstractness": 0,
          "afferent_coupling": 0,
          "distance": 0,
          "efferent_coupling": 29,
          "instability": 1,
          "recent_commit_count": 21,
          "structurally_constrained": false,
          "volatility": "volatile",
          "zone": "excluded"
        },
        "path": "cmd/analyze-modularity",
        "public_ratio": 0.2875,
        "unexported_funcs": 39,
        "unexported_methods": 11,
        "unexported_types": 7
      },
      {
        "exported_funcs": 0,
        "exported_methods": 0,
        "exported_types": 0,
        "files": 4,
        "import_path": "github.com/usadamasa/go-arch-metrics/cmd/arch-baseline",
        "interface_types": 0,
        "loc": 663,
        "main_sequence": {
          "abstractness": 0,
          "afferent_coupling": 0,
          "distance": 0,
          "efferent_coupling": 6,
          "instability": 1,
          "recent_commit_count": 5,
          "structurally_constrained": false,
          "volatility": "volatile",
          "zone": "excluded"
        },
        "path": "cmd/arch-baseline",
        "public_ratio": 0,
        "unexported_funcs": 28,
        "unexported_methods": 7,
        "unexported_types": 5
      },
      {
        "exported_funcs": 0,
        "exported_methods": 0,
        "exported_types": 0,
        "files": 1,